{
  "$schema": "https://json-schema.org/draft/2020-12/schema",
  "$comment": "Generated by scripts/export_api_schemas.py from apps/api/schemas.py: do not edit",
  "additionalProperties": false,
  "description": "The rule applied to one cluster: proposed with a decision, confirmed by the operator who\napproves it, always reversible, with a review date.",
  "properties": {
    "application_id": {
      "maxLength": 96,
      "minLength": 1,
      "pattern": "^[A-Za-z0-9][A-Za-z0-9._:~-]*$",
      "title": "Application Id",
      "type": "string"
    },
    "rule_version": {
      "maxLength": 64,
      "minLength": 1,
      "title": "Rule Version",
      "type": "string"
    },
    "cluster_id": {
      "maxLength": 96,
      "minLength": 1,
      "pattern": "^[A-Za-z0-9][A-Za-z0-9._:~-]*$",
      "title": "Cluster Id",
      "type": "string"
    },
    "decision_id": {
      "maxLength": 96,
      "minLength": 1,
      "pattern": "^[A-Za-z0-9][A-Za-z0-9._:~-]*$",
      "title": "Decision Id",
      "type": "string"
    },
    "affected_customer_ids": {
      "items": {
        "maxLength": 96,
        "minLength": 1,
        "pattern": "^[A-Za-z0-9][A-Za-z0-9._:~-]*$",
        "type": "string"
      },
      "minItems": 1,
      "title": "Affected Customer Ids",
      "type": "array"
    },
    "state": {
      "enum": [
        "proposed",
        "confirmed",
        "reversed"
      ],
      "title": "State",
      "type": "string"
    },
    "proposed_at": {
      "format": "date-time",
      "title": "Proposed At",
      "type": "string"
    },
    "confirmed_by": {
      "anyOf": [
        {
          "not": {
            "const": "system"
          },
          "pattern": "^[a-z][a-z0-9._-]{1,31}$",
          "type": "string"
        },
        {
          "type": "null"
        }
      ],
      "title": "Confirmed By"
    },
    "confirmed_at": {
      "anyOf": [
        {
          "format": "date-time",
          "type": "string"
        },
        {
          "type": "null"
        }
      ],
      "title": "Confirmed At"
    },
    "review_at": {
      "format": "date",
      "title": "Review At",
      "type": "string"
    },
    "reversible": {
      "const": true,
      "default": true,
      "title": "Reversible",
      "type": "boolean"
    },
    "reversed_by": {
      "anyOf": [
        {
          "not": {
            "const": "system"
          },
          "pattern": "^[a-z][a-z0-9._-]{1,31}$",
          "type": "string"
        },
        {
          "type": "null"
        }
      ],
      "title": "Reversed By"
    },
    "reversed_at": {
      "anyOf": [
        {
          "format": "date-time",
          "type": "string"
        },
        {
          "type": "null"
        }
      ],
      "title": "Reversed At"
    },
    "reversal_reason": {
      "anyOf": [
        {
          "maxLength": 1000,
          "minLength": 3,
          "pattern": "\\S[\\s\\S]+\\S",
          "type": "string"
        },
        {
          "type": "null"
        }
      ],
      "title": "Reversal Reason"
    }
  },
  "required": [
    "application_id",
    "rule_version",
    "cluster_id",
    "decision_id",
    "affected_customer_ids",
    "state",
    "proposed_at",
    "confirmed_by",
    "confirmed_at",
    "review_at",
    "reversible",
    "reversed_by",
    "reversed_at",
    "reversal_reason"
  ],
  "title": "CouponRuleApplication",
  "type": "object"
}
